{
  "run_id": "run-20260620T091530Z",
  "skill": "screen-cvs",
  "started_at": "2026-06-20T09:15:30Z",
  "ended_at": "2026-06-20T09:47:12Z",
  "status": "completed",
  "stop_reason": null,
  "state_write_mode": "helper",
  "usage": {
    "usage_source": "unavailable",
    "tokens_in": null,
    "tokens_out": null,
    "cost_usd": null,
    "duration_seconds": 1902
  },
  "candidates_screened": 5,
  "jd_slug": "backend-engineer",
  "scorecard_file": "cv-screening-scorecard-backend-engineer-2026-06-20.xlsx"
}
